{
  "schema": "murmuration_curve/1",
  "generated_by": "52855c9-dirty",
  "params": {"ordering": "conductor", "statistic": "unweighted arithmetic mean of a_p (HLOP eq. 1.1)", "class": "rank", "source": "HLOP Figure 1 (arXiv:2204.10140)", "ecdata_pin": "2026-04-22 / 25cec5ec", "n_primes": 300, "y_axis": "p / N2", "provenance": "a_p computed at good primes + Atkin-Lehner-converted at bad primes (oracle sign, m0-pinning §3); rank and conductor are oracle (ecdata)"},
  "family_counts": {"E0_7500_10000": 4328, "E1_7500_10000": 5194, "E0_5000_10000": 8536, "E2_5000_10000": 1380},
  "panels": [
    {"panel": "top", "color": "#2563eb", "rank": 0, "N1": 7500, "N2": 10000, "family_size": 4328, "points": [[2,0.0002,0.059842883549],[3,0.0003,0.147874306839],[5,0.0005,0.308687615527],[7,0.0007,0.394870609982],[11,0.0011,0.621072088725],[13,0.0013,0.614833641405],[17,0.0017,0.731515711645],[19,0.0019,0.698243992606],[23,0.0023,0.832717190388],[29,0.0029,0.823706099815],[31,0.0031,0.62292051756],[37,0.0037,0.682070240296],[41,0.0041,1.12569316081],[43,0.0043,0.955406654344],[47,0.0047,1.1612754159],[53,0.0053,1.13493530499],[59,0.0059,1.27356746765],[61,0.0061,0.860905730129],[67,0.0067,0.974815157116],[71,0.0071,0.98752310536],[73,0.0073,0.989371534196],[79,0.0079,0.765018484288],[83,0.0083,1.25577634011],[89,0.0089,1.26617375231],[97,0.0097,0.910351201479],[101,0.0101,1.29459334566],[103,0.0103,1.58780036969],[107,0.0107,1.4792051756],[109,0.0109,0.524722735675],[113,0.0113,1.12084103512],[127,0.0127,1.40272643253],[131,0.0131,1.48498151571],[137,0.0137,1.14186691312],[139,0.0139,1.2553142329],[149,0.0149,1.27379852126],[151,0.0151,1.26478743068],[157,0.0157,1.12430683919],[163,0.0163,1.42744916821],[167,0.0167,1.67906654344],[173,0.0173,1.54875231054],[179,0.0179,1.37084103512],[181,0.0181,0.92814232902],[191,0.0191,1.66012014787],[193,0.0193,1.40780961183],[197,0.0197,1.79505545287],[199,0.0199,1.31446395564],[211,0.0211,1.42005545287],[223,0.0223,1.88354898336],[227,0.0227,1.88193160813],[229,0.0229,1.49422365989],[233,0.0233,1.40665434381],[239,0.0239,1.97111829945],[241,0.0241,1.25970425139],[251,0.0251,1.87245841035],[257,0.0257,2.32000924214],[263,0.0263,2.22458410351],[269,0.0269,1.91081330869],[271,0.0271,1.90226432532],[277,0.0277,1.52841959335],[281,0.0281,1.94524029575],[283,0.0283,2.63424214418],[293,0.0293,1.72158040665],[307,0.0307,1.91427911275],[311,0.0311,1.57740295749],[313,0.0313,1.54413123845],[317,0.0317,1.67999075786],[331,0.0331,1.71326247689],[337,0.0337,1.47273567468],[347,0.0347,1.57162661738],[349,0.0349,1.29020332717],[353,0.0353,1.66566543438],[359,0.0359,1.58733826248],[367,0.0367,1.47966728281],[373,0.0373,1.04251386322],[379,0.0379,1.09149722736],[383,0.0383,2.02865064695],[389,0.0389,1.26709796673],[397,0.0397,1.71557301294],[401,0.0401,1.25138632163],[409,0.0409,0.945009242144],[419,0.0419,1.49607208872],[421,0.0421,0.512014787431],[431,0.0431,1.69547134935],[433,0.0433,1.25831792976],[439,0.0439,1.51478743068],[443,0.0443,1.42421441774],[449,0.0449,1.48151571165],[457,0.0457,0.97966728281],[461,0.0461,1.66335489834],[463,0.0463,1.53234750462],[467,0.0467,1.67375231054],[479,0.0479,1.7446857671],[487,0.0487,1.64741219963],[491,0.0491,1.25924214418],[499,0.0499,0.938077634011],[503,0.0503,1.78211645102],[509,0.0509,1.40411275416],[521,0.0521,1.79274491682],[523,0.0523,1.77218114603],[541,0.0541,0.794131238447],[547,0.0547,1.90388170055],[557,0.0557,1.52795748614],[563,0.0563,1.66566543438],[569,0.0569,1.7393715342],[571,0.0571,0.851663585952],[577,0.0577,0.74168207024],[587,0.0587,1.14163585952],[593,0.0593,1.02726432532],[599,0.0599,1.36067467652],[601,0.0601,0.473659889094],[607,0.0607,1.45471349353],[613,0.0613,1.11829944547],[617,0.0617,0.791358595194],[619,0.0619,0.912430683919],[631,0.0631,1.04089648799],[641,0.0641,0.983133086876],[643,0.0643,1.4533271719],[647,0.0647,1.55036968577],[653,0.0653,0.669131238447],[659,0.0659,1.4376155268],[661,0.0661,0.36252310536],[673,0.0673,0.230129390018],[677,0.0677,1.09311460259],[683,0.0683,0.705637707948],[691,0.0691,1.18877079482],[701,0.0701,1.13447319778],[709,0.0709,0.0965804066543],[719,0.0719,0.802449168207],[727,0.0727,1.08595194085],[733,0.0733,1.51340110906],[739,0.0739,0.777264325323],[743,0.0743,1.06585027726],[751,0.0751,-0.22342883549],[757,0.0757,-0.347042513863],[761,0.0761,0.0970425138632],[769,0.0769,0.445240295749],[773,0.0773,1.09057301294],[787,0.0787,0.817236598891],[797,0.0797,0.398798521257],[809,0.0809,0.756469500924],[811,0.0811,0.965573012939],[821,0.0821,0.229898336414],[823,0.0823,0.424445471349],[827,0.0827,1.06377079482],[829,0.0829,0.110443622921],[839,0.0839,0.0295748613678],[853,0.0853,-0.253003696858],[857,0.0857,1.17444547135],[859,0.0859,0.317467652495],[863,0.0863,-0.335489833641],[877,0.0877,0.570702402957],[881,0.0881,0.829251386322],[883,0.0883,0.662661737523],[887,0.0887,0.933918669131],[907,0.0907,0.694085027726],[911,0.0911,0.628927911275],[919,0.0919,-0.153188539741],[929,0.0929,-0.06353974122],[937,0.0937,1.05175600739],[941,0.0941,0.155268022181],[947,0.0947,0.283040665434],[953,0.0953,0.479898336414],[967,0.0967,0.159658040665],[971,0.0971,-0.173521256932],[977,0.0977,0.325785582255],[983,0.0983,-0.074168207024],[991,0.0991,-0.748151571165],[997,0.0997,0.548521256932],[1009,0.1009,-1.08710720887],[1013,0.1013,-0.630314232902],[1019,0.1019,0.320009242144],[1021,0.1021,-0.170517560074],[1031,0.1031,-0.294824399261],[1033,0.1033,-1.16058225508],[1039,0.1039,-0.867375231054],[1049,0.1049,-0.439695009242],[1051,0.1051,-0.450323475046],[1061,0.1061,-1.12684842884],[1063,0.1063,-0.618068391867],[1069,0.1069,-1.42952865065],[1087,0.1087,-0.884935304991],[1091,0.1091,-1.22019408503],[1093,0.1093,0.347042513863],[1097,0.1097,-0.227356746765],[1103,0.1103,-0.833410351201],[1109,0.1109,-0.864140480591],[1117,0.1117,-1.09496303142],[1123,0.1123,-0.318853974122],[1129,0.1129,-1.573012939],[1151,0.1151,-0.59219038817],[1153,0.1153,-0.900415896488],[1163,0.1163,-0.64533271719],[1171,0.1171,-1.08733826248],[1181,0.1181,-0.687384473198],[1187,0.1187,-0.704482439926],[1193,0.1193,-0.95887245841],[1201,0.1201,-2.29944547135],[1213,0.1213,-0.95101663586],[1217,0.1217,-1.22712569316],[1223,0.1223,-0.92398336414],[1229,0.1229,-0.778188539741],[1231,0.1231,-0.601432532348],[1237,0.1237,-0.470194085028],[1249,0.1249,-1.57093345656],[1259,0.1259,-0.643484288355],[1277,0.1277,-1.22758780037],[1279,0.1279,-1.64533271719],[1283,0.1283,-0.507393715342],[1289,0.1289,-0.74792051756],[1291,0.1291,-0.413817005545],[1297,0.1297,-1.87731053604],[1301,0.1301,-1.18923290203],[1303,0.1303,-1.92814232902],[1307,0.1307,-1.28280961183],[1319,0.1319,0.0025415896488],[1321,0.1321,-2.29066543438],[1327,0.1327,-1.40434380776],[1361,0.1361,-1.66012014787],[1367,0.1367,-0.55106284658],[1373,0.1373,-1.32763401109],[1381,0.1381,-1.92952865065],[1399,0.1399,-1.58479667283],[1409,0.1409,-1.39556377079],[1423,0.1423,-1.95956561922],[1427,0.1427,-1.073012939],[1429,0.1429,-3.01178373383],[1433,0.1433,-1.68068391867],[1439,0.1439,-1.43646025878],[1447,0.1447,-2.57994454713],[1451,0.1451,-0.984750462107],[1453,0.1453,-2.61575785582],[1459,0.1459,-1.50115526802],[1471,0.1471,-1.99283733826],[1481,0.1481,-1.79297597043],[1483,0.1483,-0.790896487985],[1487,0.1487,-1.24768946396],[1489,0.1489,-2.66543438078],[1493,0.1493,-2.13886321627],[1499,0.1499,-2.50554528651],[1511,0.1511,-2.34542513863],[1523,0.1523,-1.1924676525],[1531,0.1531,-1.64487060998],[1543,0.1543,-2.52634011091],[1549,0.1549,-1.82578558226],[1553,0.1553,-1.69685767098],[1559,0.1559,-1.23313308688],[1567,0.1567,-1.80083179298],[1571,0.1571,-2.14325323475],[1579,0.1579,-2.0780961183],[1583,0.1583,-1.02680221811],[1597,0.1597,-2.08479667283],[1601,0.1601,-1.85743992606],[1607,0.1607,-1.74607208872],[1609,0.1609,-2.34265249538],[1613,0.1613,-0.570240295749],[1619,0.1619,-0.42028650647],[1621,0.1621,-2.36182994455],[1627,0.1627,-1.42375231054],[1637,0.1637,-1.95124768946],[1657,0.1657,-1.88632162662],[1663,0.1663,-2.72250462107],[1667,0.1667,-1.93784658041],[1669,0.1669,-2.1148336414],[1693,0.1693,-2.11737523105],[1697,0.1697,-1.64279112754],[1699,0.1699,-2.04436229205],[1709,0.1709,-2.41266173752],[1721,0.1721,-0.931839186691],[1723,0.1723,-0.81977818854],[1733,0.1733,-1.99306839187],[1741,0.1741,-2.17259704251],[1747,0.1747,-1.79574861368],[1753,0.1753,-3.14117375231],[1759,0.1759,-2.41797597043],[1777,0.1777,-3.43507393715],[1783,0.1783,-1.70194085028],[1787,0.1787,-1.83941774492],[1789,0.1789,-2.71002772643],[1801,0.1801,-2.83156192237],[1811,0.1811,-1.91404805915],[1823,0.1823,-2.23290203327],[1831,0.1831,-2.04898336414],[1847,0.1847,-1.301987061],[1861,0.1861,-2.62846580407],[1867,0.1867,-1.58387245841],[1871,0.1871,-0.802680221811],[1873,0.1873,-2.26317005545],[1877,0.1877,-2.12846580407],[1879,0.1879,-1.5935767098],[1889,0.1889,-2.2396025878],[1901,0.1901,-2.55868761553],[1907,0.1907,-1.63378003697],[1913,0.1913,-1.47435304991],[1931,0.1931,-1.21095194085],[1933,0.1933,-0.488678373383],[1949,0.1949,-1.28327171904],[1951,0.1951,-2.41427911275],[1973,0.1973,-1.06585027726],[1979,0.1979,-0.946626617375],[1987,0.1987,-1.59034195933]]},